{
  "$schema": "../../schemas/p5-evidence-v1.schema.json",
  "schemaVersion": "p5-evidence-v1",
  "evidenceId": "p5-matrix-profile-bootstrap-20260731",
  "phase": "P5",
  "overallStatus": "partial",
  "localBootstrapStatus": "executed-pass",
  "hostedGateStatus": "not-run",
  "source": {
    "handoffCommit": "84515289913dfe8a7452754ad442d37873bdfd53",
    "sourceCommit": "b5d76d220bb19e11c36d833c0bb2595433bbc727",
    "branch": "codex/p5-matrix-profile-bootstrap",
    "upstreamBase": "db52e28f4d9ded852ab3942cea316258ae4ef346"
  },
  "environment": {
    "os": "windows",
    "architecture": "x64",
    "node": "24.18.1",
    "npm": "11.16.0",
    "filesystem": "NTFS",
    "environmentClass": "local-windows-x64-ntfs-run-owned",
    "privatePathsPersisted": false
  },
  "profileResults": [
    {
      "profileId": "policy-validation",
      "blocking": true,
      "localStatus": "local-pass",
      "hostedStatus": "not-run",
      "disposition": "local exact validators and policy tests passed; hosted execution requires authorization",
      "runtimeImplemented": true,
      "deferredPhase": null,
      "evidenceIds": [
        "p5-p3-validator",
        "p5-p4-validator-at-handoff",
        "p5-targeted"
      ]
    },
    {
      "profileId": "install-build",
      "blocking": true,
      "localStatus": "local-pass",
      "hostedStatus": "not-run",
      "disposition": "exact npm clean install and generated TypeScript build passed locally",
      "runtimeImplemented": true,
      "deferredPhase": null,
      "evidenceIds": [
        "p5-npm-ci",
        "p5-build"
      ]
    },
    {
      "profileId": "unit",
      "blocking": true,
      "localStatus": "local-pass",
      "hostedStatus": "not-run",
      "disposition": "unit partition passed locally with serial file execution",
      "runtimeImplemented": true,
      "deferredPhase": null,
      "evidenceIds": [
        "p5-full-regression"
      ]
    },
    {
      "profileId": "core-contract",
      "blocking": true,
      "localStatus": "local-pass",
      "hostedStatus": "not-run",
      "disposition": "current and previous exact Codex direct and broker lifecycle oracles passed locally",
      "runtimeImplemented": true,
      "deferredPhase": null,
      "evidenceIds": [
        "p5-p4-targeted",
        "p5-codex-current-lifecycle",
        "p5-codex-previous-lifecycle"
      ]
    },
    {
      "profileId": "windows-integration",
      "blocking": true,
      "localStatus": "local-pass",
      "hostedStatus": "not-run",
      "disposition": "serial Windows integration and exact PID plus exclusive handle postcondition passed locally",
      "runtimeImplemented": true,
      "deferredPhase": null,
      "evidenceIds": [
        "p5-windows-resource",
        "p5-full-regression"
      ]
    },
    {
      "profileId": "claude-lifecycle",
      "blocking": true,
      "localStatus": "local-pass",
      "hostedStatus": "not-run",
      "disposition": "minimum and current exact Claude structural validation passed without authentication or inference",
      "runtimeImplemented": true,
      "deferredPhase": null,
      "evidenceIds": [
        "p5-claude-minimum",
        "p5-claude-current"
      ]
    },
    {
      "profileId": "security",
      "blocking": true,
      "localStatus": "local-pass",
      "hostedStatus": "not-run",
      "disposition": "pinned actionlint, zizmor, OSV Scanner, and gitleaks checks passed locally",
      "runtimeImplemented": true,
      "deferredPhase": null,
      "evidenceIds": [
        "p5-actionlint",
        "p5-zizmor",
        "p5-osv",
        "p5-gitleaks"
      ]
    },
    {
      "profileId": "dependency-review",
      "blocking": true,
      "localStatus": "not-applicable",
      "hostedStatus": "not-run",
      "disposition": "GitHub dependency review action requires a hosted pull request context",
      "runtimeImplemented": true,
      "deferredPhase": null,
      "evidenceIds": []
    },
    {
      "profileId": "next-canary",
      "blocking": false,
      "localStatus": "not-run",
      "hostedStatus": "not-run",
      "disposition": "non-blocking-canary",
      "runtimeImplemented": true,
      "deferredPhase": null,
      "evidenceIds": []
    },
    {
      "profileId": "windows-c0",
      "blocking": false,
      "localStatus": "blocked-with-evidence",
      "hostedStatus": "blocked-with-evidence",
      "disposition": "native Windows capability artifact and disposable Windows 11 runner evidence do not exist",
      "runtimeImplemented": false,
      "deferredPhase": "v0.2",
      "evidenceIds": [
        "P5-C0-BLOCKED"
      ]
    },
    {
      "profileId": "state-d1",
      "blocking": false,
      "localStatus": "blocked-with-evidence",
      "hostedStatus": "blocked-with-evidence",
      "disposition": "shipping SQLite binding, DDL, migration, and runtime evidence do not exist",
      "runtimeImplemented": false,
      "deferredPhase": "v0.2",
      "evidenceIds": [
        "P5-D1-BLOCKED"
      ]
    }
  ],
  "authenticatedClaude": {
    "executionStatus": "not-run",
    "authorized": false,
    "secretUsed": false,
    "paidInferenceUsed": false
  },
  "hostedRunner": {
    "requestedLabel": "windows-2025",
    "imageVersion": null,
    "osBuild": null,
    "architecture": null,
    "filesystem": null,
    "executionStatus": "not-run"
  },
  "localChecks": [
    {
      "id": "p5-red",
      "requirementIds": ["P5-1", "P5-12"],
      "fixtureIds": ["P5-RED-001"],
      "trial": 1,
      "retryCount": 0,
      "timeout": false,
      "rawExitCode": 0,
      "startedAt": "2026-07-31T06:43:00Z",
      "finishedAt": "2026-07-31T06:43:01Z",
      "wallTimeMs": 1,
      "executionStatus": "executed-pass",
      "expected": "meaningful pre-implementation RED is retained in the ordered attempt ledger",
      "observed": "seven exact missing-contract assertions failed before implementation and remain recorded",
      "artifactSha256": null,
      "runtimeEnforced": false,
      "deferredPhase": null
    },
    {
      "id": "p5-targeted",
      "requirementIds": ["P5-1", "P5-2", "P5-10", "P5-12"],
      "fixtureIds": ["P5-PROFILE-001", "P5-PARTITION-001", "P5-WORKFLOW-001"],
      "trial": 1,
      "retryCount": 0,
      "timeout": false,
      "rawExitCode": 0,
      "startedAt": "2026-07-31T11:36:59Z",
      "finishedAt": "2026-07-31T11:37:05Z",
      "wallTimeMs": 5591,
      "executionStatus": "executed-pass",
      "expected": "P5 policy, partition, evidence, privacy, false-green, and canary controls pass",
      "observed": "14 of 14 targeted P5 tests passed with zero failure and zero skip",
      "artifactSha256": null,
      "runtimeEnforced": true,
      "deferredPhase": null
    },
    {
      "id": "p5-exact-node",
      "requirementIds": ["P5-2"],
      "fixtureIds": ["P5-NODE-EXACT-001"],
      "trial": 1,
      "retryCount": 0,
      "timeout": false,
      "rawExitCode": 0,
      "startedAt": "2026-07-31T11:34:52Z",
      "finishedAt": "2026-07-31T11:34:53Z",
      "wallTimeMs": 1086,
      "executionStatus": "executed-pass",
      "expected": "Node 24.18.1 x64 and npm 11.16.0 are acquired from the admitted archive",
      "observed": "exact version, architecture, archive digest, and node executable digest matched",
      "artifactSha256": "ec56b84a7551893ab2324ebdfdc4ab974a63b4781162600b68a1293cc3e53765",
      "runtimeEnforced": true,
      "deferredPhase": null
    },
    {
      "id": "p5-npm-ci",
      "requirementIds": ["P5-3"],
      "fixtureIds": ["P5-NPM-CI-001"],
      "trial": 1,
      "retryCount": 0,
      "timeout": false,
      "rawExitCode": 0,
      "startedAt": "2026-07-31T11:34:53Z",
      "finishedAt": "2026-07-31T11:34:55Z",
      "wallTimeMs": 1500,
      "executionStatus": "executed-pass",
      "expected": "exact npm clean install preserves the lockfile and reports no audit issue",
      "observed": "three packages installed, four packages audited, zero vulnerabilities, lockfile unchanged",
      "artifactSha256": null,
      "runtimeEnforced": true,
      "deferredPhase": null
    },
    {
      "id": "p5-p3-validator",
      "requirementIds": ["P5-1", "P5-10"],
      "fixtureIds": ["P5-P3-READBACK-001"],
      "trial": 1,
      "retryCount": 0,
      "timeout": false,
      "rawExitCode": 0,
      "startedAt": "2026-07-31T11:34:50Z",
      "finishedAt": "2026-07-31T11:34:52Z",
      "wallTimeMs": 2083,
      "executionStatus": "executed-pass",
      "expected": "P3 exact toolchain, policy, ledger, and privacy readback passes",
      "observed": "P3 validator passed unchanged",
      "artifactSha256": null,
      "runtimeEnforced": true,
      "deferredPhase": null
    },
    {
      "id": "p5-p4-validator-at-handoff",
      "requirementIds": ["P5-1", "P5-10"],
      "fixtureIds": ["P5-P4-HANDOFF-001"],
      "trial": 1,
      "retryCount": 0,
      "timeout": false,
      "rawExitCode": 0,
      "startedAt": "2026-07-31T06:59:00Z",
      "finishedAt": "2026-07-31T06:59:29Z",
      "wallTimeMs": 28900,
      "executionStatus": "executed-pass",
      "expected": "byte-identical P4 validator passes at the exact P4 final commit in a detached worktree",
      "observed": "exact Node and npm identity, dependency-free exact Codex generation, and original P4 validator passed",
      "artifactSha256": null,
      "runtimeEnforced": true,
      "deferredPhase": null
    },
    {
      "id": "p5-p4-targeted",
      "requirementIds": ["P5-3", "P5-4"],
      "fixtureIds": ["P5-P4-CONTRACT-001"],
      "trial": 1,
      "retryCount": 0,
      "timeout": false,
      "rawExitCode": 0,
      "startedAt": "2026-07-31T07:06:00Z",
      "finishedAt": "2026-07-31T07:06:02Z",
      "wallTimeMs": 2000,
      "executionStatus": "executed-pass",
      "expected": "P4 targeted contract partition passes once on the current lane",
      "observed": "40 of 40 tests passed with zero skip",
      "artifactSha256": null,
      "runtimeEnforced": true,
      "deferredPhase": null
    },